sports, associations, events
aikido, Poetry Pals, New Year's Party (13 Jan)
basketball, Debate Club, Valentine's Dinner (14 Feb)
tennis, Science Society, Carnival Night (1 March)
swimming, Painting and Pottery, Karaoke Night (18 April)
football, Language Club, Kayaking Trip (5 May)
Zumba, International Students Society, Seaside Picnic (15 Sep)
karate, Students for Sustainability, Halloween Party (31 Oct)
yoga, Animal Shelter Volunteers, Thanksgiving Jamboree (26 Nov)
waterpolo, Bunch of Backpackers, Christmas Dinner (18 Dec)